USER,STAR,DATE,LIKE,REVIEW
루데스, 1,2021-05-31,2,다좋은데 버그인가요? 영상은 재생되는데 화면 쥐꼬리만하게 나오는거?진짜 욕나올정도로 불편한데 개선이없네요? 가로로 보다가 새로로 들어가면 화면 고정되있고 영상 짤리고
뵤뵤, 1,2021-05-26,0,아니 도대체 언제쯤 안튕겨요??? 하루에도 몇번이나 튕기고 느려지고 렉걸리고 그놈의 '응답하지 않습니다 않습니다 않습니다' 진짜 지긋지긋하네요.
임가, 1,2021-05-22,0,"지금 유투브 업데이트했는데 이상하네요 스크롤이 내려가지 않고 영상이 뜨지를 않네요 정확히는 영상 3,4개만 보이고 그 밑으로 스크롤이 안내려가요"
룰루랄라미술튜브, 4,2021-05-27,1,"다른사람과 즐겁게 소통할 수 있어 즐겁고 일상에 유익합니다! 그런데 아쉬운점은 유튜브 채널 아트나, 대표영상 등.. 이런것들을 바꾸는게 많이 어렵습니다ㅠ"
정다혜, 1,2021-06-07,3,베타만 보면 자꾸 처음으로 돌아가요ㅠ 예전엔 그냥 짧은 동영상이었던 것들이 전부 베타가 되서 불편합니다 다시 수정 부탁드려요 좀 더 편리한 기능 부탁드립니다
vagabond 815, 4,2021-05-26,1,광고 거지같음 필터링이 전혀 없음 아직도 선정적인 광고가 너무 쉽게 자주뜸 심지어 성인도 안된 조카것들이 지들 폰에서 볼때도 앙앙 거리면서 가슴 흔들리는 광고 심심찮게 나옴
언니야Q, 2,2021-05-30,0,광고 좀 줄여주세요 무슨 영상 한 번 보는데 광고가 2번이나 나오고 길고 예전에는 많이 안 그랬는데 가면 갈 수록 심해지네요;;;;
임정욱, 1,2021-06-11,2,"진짜 다좋은데 유튜브 프리미엄 만원 넘어가는건 좀 선넘는듯.. 한달에 만원? 에바지;; 잠시 끊겼는데 8,690원에서 10,450이 됐네"
민태현, 5,2021-05-26,0,잘 사용중인 앱이에요! 다만..요줌이 화질이 너무 안좋아지고 볼때 불편한점 빼고는 다 너무 좋고 완벽한 앱인것 같습니다.
최현용, 5,2021-05-26,0,"안녕하세요아빠패드로유툽보는사람입니다너무재밋어요!내이버에는로그인은안돼고,그러면구독이랑댓글도못보는데최고입니다.별1개주는사람이해가안가요아무튼전별5개말구별111100009999999개주고싶네요그럼안뇽"
노랑노랑 무지 이소율, 4,2021-06-07,0,좋아요!😆 동생도 좋아하네요. ㅎㅎ 좋은영상이 많네요. 초등학생에게 어울리는 영상도 더 올려 주었으면 더욱 좋겠습니다~♥ 감사합니다.😊
"호키유튜브 Hoki[구독자1000명, 수익창출 목표]", 3,2021-05-26,0,"좋고 소통도 할수있어서 좋으나 이상하거나 비매너유저, 욕설 사용자가 있어서 좀.. 저는 나쁜사람이랑 싸운적 있습니다. 유튜브 채널 운영도 힘들구.."
장미라, 5,2021-05-27,3,비타민D 정말 나이들어서는 꼭챙겨먹어야하는 필수라고생각합니다 평소에 이제품을 즐겨먹었는데 너무좋아서 추천합니다 저는 이제품먹고 정말건강해졌어요~~10년전 유방암2기로 투병생활 끝내고 정상회복한지 10년이 넘었네요모두들이약드시고건강하세요~~
스만, 1,2021-05-28,0,아니 노트20울트라 쓰는데 위로 슬라아스를 안하고 꾹누르고만 있어도 내렸던 스크롤을 돌러버리네..프리미엄까지 쓰는데 에바아니냐 또 심지어 아이폰은 정상적으로 잘된다.ㅋㅋㅋ
이얏호응, 1,2021-06-09,2,유튜브 사용을 하다가 멈춰놓고 다른 어플을 쓰거나 시간이 좀 지난뒤 다시 유튜브를 들어가면 화면은 멈춰있고 댓글창은 전부 회색화면으로 바껴있습니다 한달전쯤부터 나타난거같은데 좀 고쳐주세요 ㅜ
이제운, 4,2021-05-26,1,음악듣고싶으면 1시간짜리 동영상 찾아다녀야 하는 구시대적인 ux가 남아있음. 반복재생 만들어주면 안되나 재생목록 맨날 새로파야함
김덕선, 5,2021-06-01,1,"제가 원래 네이버로 동영상을 검색해서 보는데,유튜브토보니 너무 좋네요♡전 완내스고요 유튜브를 깔지말지 고민되는 분들은 꼭!까세요.강추드립니다~^-^"
하늘, 1,2021-06-10,2,유튜브 진짜 좋은데 차단기능은 댓글을 못하게 하는게 아니라 아예 채널을 검색해도 안나오고 영상도 안나오면 좋겠어요 제가 싫어하는 영상이 나오면 채널 들어가서 차단했는데 상대방 차단인줄 알았는데 쪼잔하게 댓글 못하게 하는거....이거좀 추가해주세요
양서진, 5,2021-05-26,0,너무 재미있고 좋은데 문제가 폰바꾼지 얼마안됬는데 갑자기 가끔식 랙이ㅠ걸리고 2분동안 안디는 경우가있어요 이것만 고처 주세요.ㅠㅠ
김수정, 5,2021-06-02,0,나는 이 유튜브가 너무너무 감사드리고 앞으로도 잘 쓸게요 감사합니다 코로나 조심히 이겨내며 마스크도 잘 쓰실 바랍니다 저도 마스크를 잘 사용하고 있습니다.
ᄋᄋ, 2,2021-06-07,0,진짜 제발 유튜버나 어떤단어 차단기만들어주시고 알고리즘으로도 안 보이게좀 해주세요 아니면 프리미엄기능에 추가해 주시면 저 진짜 평생 프리미엄 쓸 자신 있습니다. 제발 떼돈벌고 싶으면 잡기능 만들지 말고 이것좀 제발 만들어주세요 진짜부탁드립니다.
도우마, 1,2021-06-12,0,유튜브영상을 저장하려 하는데 갑자기 유튜브 재생목록이 다 사라졌더라고요? 이거 저만그런지는 모르겠지만 이거 빨리 고쳐주시길 바랍니다
처음처럼HD, 1,2021-06-11,0,"최신버전 업데이트 후 광고 더 많이 뜸. 이전에는 컨텐츠 영상의 광고 다보고나서 곧바로 다른 영상 틀면 광고 안나왔는데, 이제는 영상 누르는 족족 전부 광고나옴."
곰돌희, 3,2021-05-26,1,광고가 이중 광고가 나오면서 불편하고요. 그리고 가끔 가다 보면 이미지 광고에 좀 민망한게 나옵니다. 아이들이 보기에는 좋지 않은것 같아요 그 점 고쳐 주시면 좋겠네요
화서닝, 4,2021-05-26,1,추천동영상을통해 시청자에게 맞춤 영상을 제공하는게 좋습니다!근데 아쉬운점은 조금 불건전한 컨텐츠가 있는것 입니다.
예린찡, 2,2021-05-30,1,"광고가...솔직히 있다고해도 너무 심하네요 그리고 PC만 가능한기능도 태블릿,휴대폰에도 할수있게해주세요.그리고 요즘따라 광고스킵버튼도 안나오는데 너무 기네요"
하참, 5,2021-06-01,0,유튜브는 모두가 쓰기장말 좋은앱이며 저한테도 정말 만족스럽고 최고의 앱입니다. 제작자님 아픙로도 좋은 업데이트 기대 하겠습니다.^^
Nayoung, 3,2021-06-12,0,제발.... 터치하면 자동 스크롤업되는 기능이랑 데이터가 안받아와지면 댓글창도 안닫혀지는.....그런 버그 수정좀 해주세요....
임채원, 3,2021-06-09,0,동일한 환경에서 이 단말기로 광고 건너뛰기만 하면 무한 버퍼링이 걸려서 영상을 껐다켜야되는데 이것도 의도한건가요?
한중희, 4,2021-05-29,10,"유튜브는 다양한 콘텐츠를 만들고 재미있는 영상 올리는 것이 유튜브 입돠 저는 제일 좋아하는 채널이 잠뜰,공룡,덕개,라더,수현,각별,김블루,연다,흔한 남매 이러게 좋아합니다 물론 다른 채널도 좋아합니다 ㅎㅎ 제 의견을 보신분들은 무슨 채널를 좋아하는지 써주시면 감사하겠습니다 긴글 읽느라 수고 하셨습니다 ㅎㅎ(광고 시간이 조금 길음) 에헴;;;;"
오우오우싸발적이고, 2,2021-06-12,0,갤21플러슨데 프리미엄 쓰면서 노래틀고 화면을 끄면 노래가 나오다가 멈춤니다;; 이러면 프리미엄을 하는이유가 없는거같은데요
애니메이터-제루, 5,2021-06-09,0,인기있을 가치가 있는 앱입니당! 하지만 영상을 올리면 영상이 복사되서 하나를 삭제하면 다음날 영상이 사라져있는 버그가 있네요
블렉, 1,2021-05-18,4,탐색도 그지같고 그냥 좀 놔두고 사용하게 두세요... 같지도 않은 업데이트 때문에 계속 성질나거든요..ㅡㅡ 돈 쓰면서 불편겪는거 기분 더럽네요..ㅡㅡ
jlsu 1234, 3,2021-05-26,0,좋은노래들도 많고 재미있는영상들도많아서 좋아요 그런데 남을 못까서 환장을 한사람들이 왜이리 많을까요 유튜버분들 자살안하시는게 대단하다고 느껴질정도임니다.
마니무, 1,2021-05-26,0,동영상 화질 선택하는거 업데이트전으로 다시 되돌려주세요 자꾸 높은화질로 선택해도 자동으로 낮아지고 높은화질을 아예 선택할수없게 없애버리고 너무 별로네요
정성용, 5,2021-05-31,0,태블릿에서 가입방의 커뮤니티에 들어가면 pc나 핸드폰 최신버전에만 지원된다고 하는데 태블릿에 설치된 버전도 최신인데 왜 이런건가요....이상함
박경숙, 5,2021-05-31,1,연령과 남 녀 구분 또는 취미등 관심사를구분하여 동영상 컨텐츠를 추천해주는 그런것도 좋을것 같아요. 광고도 마찬 가지구요.~
이우석, 1,2021-05-24,1,"쓸데없는 화질 설정, 거부감이 드는 광고에도 모자라 쇼츠는 내가 어떤 걸 클릭하든 내리면 계속 똑같은 이상한 외국 쇼츠 밖에 안나옴. 심지어 그중에 80% 이상이 틱톡."
노은지, 3,2021-06-03,0,프리미엄 이용하는데 왜 화면 작게 하고 보고 들었다가 다시 크게 해서 보면 댓글들이 안 뜨고 엑스를 눌러도 안닫히죠?사용기록에서 지우고 다시 열어도 그래요 프리미엄이여도 불편하네요...개선 좀 해주셨으면 합니다
퐁삼, 3,2021-05-26,0,구독채널 목록에서 어느 채널에 들어가서 보고 되돌아올때 목록이 그 채널이 있던 위치에 유지되어 있었으면 좋겠어요. 계속 맨 윗 페이지로 올라와있으니까 다시 내려서 찾기가 힘들어요.
강태경, 3,2021-06-02,0,어이를 밥 말아 먹겠네 전체화면해서 확대하고 창 줄이면 와 다시 전체화면이 안되는거죠? 그리고 야한광고 나오면 유튜브레드 안했지 돈 아까워라!!!
PRE PRE, 1,2021-06-08,59,영상 재생중에 자꾸 중간중간 화면이멈추네요 오디오는 계속나오는데 그럴때마다 5초전으로 돌리면 다시 5초전부터 해서 제대로 재생되기는하는데 이런일이 자꾸반복되니불편하네요
야구의 역사는 타이거즈, 4,2021-05-27,1,이거 영상 올리는 유튜버로써 말씀 드립니다. 먼저 영상을 올려서 영상이 올려진 후에도 보관함에 동그라미 화살표가 계속 있어서 불편합니다.
유선주, 4,2021-06-02,0,"지난달부터왜..자꾸유투브실행하면1분이상버퍼링걸릴까요..10만원짜리5G요금제에 노트10+,유투브프리미엄인데..왜매번이러는걸까요.."
Young Il Kim, 1,2021-05-22,2,점유율 사실상 독점이라고 너무 막나가네...광고가 일단 너무 많아졌는데 대놓고 프리미엄 결제 하라고 모는 거 같고...적당히 좀 하세요...그러다가 대체재 나오면 망할 각인데
냠냠쵸린, 4,2021-05-30,1,안녕하세요? 유튜브를 오랬동안 해보았던 유저입니다. 그 제가 구독자가 24명이었는데 버그로 인해 이젠 11명이 되어버렸어요 근데 그 버그가 어떡해 해도 절대 안풀려서 계정을 새로 파야만 했어요 정말 억울하네요 그리고 잘 안나오던 광고가 6~7번정도 계속해서 나오더라구요 닫으면 나오고 계속 반복이 돼요 혹시 업데이트를 하신거라면 제발 없애주세요 어제부터 너무 불편했습니다 영상 한번 볼려면 5개에서 6개나 되는 광고를 봐야해요..
CW L, 1,2021-05-20,1,이번에 생긴 화질설정하는게 되게별로네요... 작게해서 보면서 다른거하는데 하나하나 화질 낮게설정되서 설정하는데 너무 귀찮게 바뀐거 같습니다
조랑말, 1,2021-06-08,1,와이파이 데이터 할 것 없이 앱 자체가 계속 끊겨서 영상을 틀어도 뭔 말하는지 알아들을수도 없게 끊기는데 유튜브 도대체 왜이러나요ㅡㅡ
꼬르륵, 1,2021-06-06,0,요즘들어 렉이 너무 심해요;; 댓글보다가도 갑자기 멈춰서 끊기고 강종하고 다시 켜도 안되고 다른건 다좋는데 렉좀 고쳐주세요 하 진짜 렉 개심하네 유튜브 뮤직도 그렇고
이해라, 2,2021-05-31,1,아니 솔직히 모든 광고를 못넘기고 광고를 보는데 돈을 받는건 그냥 쌩양아치짓이잖아요😡 솔직히 이건 그럼 광고보기 싫으면 유튜브 프리미엄 결제 하던가라는 말이 잖아요 이것때문에 유튜브 망하면 당신들 잘못이니까 당장 고치세요😡😡😡
j의게임세상, 1,2021-05-23,1,이 4가지 없는 알고리즘 내체널을 방해하네? 영상 길이 짧은거 만드니까 조회수 감소를 너무 심하게 먹임 이알고리즘 일부러 그러는거임 내체널을 망하게 하려는건가 별1개 주기도 아깝네 여러분 유튜브 댓글만 다시고 체널 운영하지마세요 알고리즘이 조회수 감소먹일겁니다
Kaya Kim, 1,2021-06-03,0,동영상 연속 재생 설정을 사용하지 않음으로 해두었는데도 어느 순간부터 적용이 되지않더니 자동으로 다음 영상이 재생됩니다
정지우, 1,2021-06-10,0,신고는 상대방을 제재시키는게 아니라 내가 뭐에 기분 나빴는지 글을 쓰고 신고가 완료되었다면서 정신승리하는 기능인지는 유튜브로 처음 알았습니다.
만소리, 4,2021-05-26,1,왜 무선헤드폰이나 이어폰의 일시정지기능을 일부 제한했는지...그거 못쓰니까 답답하네요. 그래서 별 하나 줄였습니다
Locked box, 3,2021-06-06,0,간헐적으로 스크롤을 내리면 다시 올라가는 증상이 있습니다 +어느날 부터 갑자기 댓글창이 안사라지는 버그가 있습니다 21.06.06
초딩루시, 5,2021-05-31,2,"관리자분 다좋은데 이 기능만 생겨주시면 안될까요? 일단1.이상한 유튜버 영상채널 삭제 차단 기능 만들어주세요,2.모바일로 채널아트 색션 해주세요.,3.1000명 아니여도 커뮤니티 해주시면 감사하겠습니다."
김영호, 2,2021-06-12,0,라이브 방송 보다 일반 동영상 보면서 옵션 누르면 팅기는거 언재 고침?라이브 보다 다른거 배속 볼려고 하면 팅겨서 다시 켜야하는거 몇달짼데 고치질 않네
두뇌풀가동!, 1,2021-06-05,0,댓글 스크롤 문제 오류에 동영상 끊김에 ㅋㅋ 갤21로 바꾼지 반 년도 안됐는데 이거 유튜브 문제 아닌가요? 유튜브같은 경쟁사 나와야 정신차릴듯
Wonpyo E, 1,2021-06-08,1,갈수록 쓸모없는 기능만 많아지고 기능 추가에만 급급해서인지 기본적인 버그도 안 잡네요. 광고랑 댓글 팝업 안 내려가는 것 좀 수정하세요
이상윤, 1,2021-05-29,0,화질 설정 패치되고 너무 불편해요 예전패치가 훨 나아요 돌려놔주셨음 해요 수동으로 1080p로 바꿔도 자동으로 720p420p로 바뀌어요 너무 불편해요
hara jang, 1,2021-06-09,0,정기 결제 중지해놨었는데 오늘 결제가 되었어요 그런데 유튜브 앱 들어가서 보니 프리미엄으로 안 바껴있어요 결제는 되고 프리미엄은 아니고환불해주세요
이정의, 2,2021-05-30,1,유튜브앱으로 틀면 소리가 작아요 다시 깔거나 업데이트를 해도 똑같아요 앱말고 크롬이나 네이버등으로 들어가면 소리가정상적으로 나옵니다 ㅠ
제이스, 1,2021-05-26,0,왜인지 모르겠는데 유투브프리미엄을 쓰고있음에도 유투브시작시 로딩이 오래걸리고 그냥 그대로 다운되는경우가 많아요
유무선, 5,2021-05-26,0,동영상으로 무엇이든 정보도 불수 있어 좋아요. 또 재미있는 동영상도 보고 공유도 할수 있어요.그레서 별5을 드려요.
크로마ਗ਼틱๛톡ᕙ, 1,2021-05-22,1,내가 심심할 때 즐길 수 있음 다만 광고를 너무 많이 넣어서 나의 시간에 영향을 끼침 그리고 나이제한 동의하고 나니깐 댓글은 못달고 영상도 못올림 그야말로 쓸모없어짐
나무놀부, 2,2021-06-02,1,선정성 기준이 뭘까요 생리컵 영상같이 유익한 영상들은 짤리고 어떻게든 조회수 한번 벌어보려고 하는 영상들은 신고를 해도 멀쩡하네요 요즘 끊어짐도 계속 심하고 유튜브는 어린아이들도 볼 수 있음에도 광고들이 너무 자극적입니다..
Michael Saint, 4,2021-05-31,1,AI로 뭐 유해 동영상 잘 판별하는데 아직 기술이 고도 안정화가 된거 같지는 않음... 더 발전하길... 4점 줍니다.
백죠, 5,2021-06-05,3,뭐 유튜브는 믿고 보는거지 😆 ... 지만 최근 업데이트로 기본 1080p60으로 설정해도 자꾸 화질이 내려가는데 이것만 좀 개선해주셨으면 좋겠습니다 😄
D D, 2,2021-06-02,0,리뷰한번도남겨본적없는대 썸네일에서 자동재생꺼도 소리없이 재생되는거 정신사나워 죽겠고 폰 2년써서 렉걸리나했더니 새폰바꿔도 영상 몇개보면 중간에 버퍼링돌아감ㅡㅡ
정인수의 게임일기, 3,2021-05-31,0,제발 데이터 많이써도 좋으니까 걍 해상도 고정기능좀 만들어줘라 요즘세상에 1080p가 아닌 핸드폰이나 모니터가 어디있다고 매번 720p로 고정되는지 모르겠네 제발 해상도 고정좀
c um, 3,2021-05-26,0,영상을 재생하면 밑으로 드렉이 안되고 자꾸 버그걸린거처럼 왓다갔다 합니다. 덤으로 모바일로 할경우요.
키득까르르, 1,2021-06-10,1,실시간 댓글보기는 왜 나오는건지ㅡㅡ 자막가려요 생각이 있는건지 없는건지 미리 테스트 안하나???? 가리는지 안가리는지 죠낸 불편함 빨리 없애요
김용욱, 1,2021-06-11,1,이 시대를 살아가는 모든 이들과 어린이부터 노인들에게도 관심 가지고 징말 좋고 유익한 우리들이 필요 했던 좋은 Contents들도 더불어 같이 성장하고 많은 유튜버들이 열성과 노력으로 참지식도 전해주고 해서 항상 매우 즐겁게 시청 합니다. 코로나 19 시대 YouTube가 있어 무료한 일상에 있어 너무 좋은 취미로 YouTube와 함께 살아간다는것과 좋은 정보를 제공 하고 공유 서로에게 공유하는것이 보기 좋습니다. 유튜브 항상 사랑해요~
김지은, 1,2021-05-31,2,이 사람들아 유료화 왜 하냐고 안 그래도 광고 많은데 욕 나오게 하지말고 제발 원래대로 하라고 별 한개도 아까워 이 사람들아 코로나로 가뜩이나 힘든데 하 .. 열불나게 만드네 제발 유튜브 제대로 일해요
민지, 1,2021-06-06,2,"광고가 너무 많이 뜨고 시간도 긴게 여러번 떠서 불편하네요 조금만 적게 넣으시던가.. 너무 많이 떠서 스트레스 받아요, 그리고 들어갈 때마다 유튜브 프리미엄 광고 뜨는것 좀 줄여주세요.."
관짝지찬, 1,2021-06-05,1,아니 요즘일안하나요? 화질조정설정도 더귀찮게바뀌고 화질 자동으로 떨어져서 수동으로 조정해야하고 운영왜이렇게합니까?고쳐주세요 불편합니다
투투, 1,2021-05-22,0,광고 싫어요. ㅋㅋ 너무 많아. 돈 내고 프리미엄 쓰라고요? ㅋㅋ 가진 자들이 너무 한다.ㅠㅠ
- Xinder -, 5,2021-05-21,0,알고리즘이 대단하고요 그리고 영상 몇개 안올렸는데 구독자가 빨리 늘어요! 유튜브는 알고리즘이 짱이라고 생각합미당
오하영, 1,2021-05-31,0,이번 화질패치 정말 최악. 영상도 끊겨서 보임. 영상은 안움직이고 소리만 나는 버그는 도데체 왜 생기는 건가요
김마에, 5,2021-05-26,0,화질선택하는거 1080으로 보려면 옛날에는 바로 떴는데 지금은 선택하는 단계가 너무 많아요.. 수정좀 해주세요
신혜주, 1,2021-06-11,1,댓글창 하얗게되고 x눌러도 안내려가는 버그좀 고쳐주세요 앱 껏다켜야 되잖아요; 왜자꾸 시키지도 않은짓을 해서 버그를 생성하는지;
yong suk CHOI, 1,2021-05-27,1,시작화면 변경 가능하게 해주세요 더 이상 영상 플랫폼이 아니라 정신없는 sns로 전락해 버렸네요 요새 정말 정신사나와서 짜증납니다
내 마음, 2,2021-05-30,0,"광고가 그.. 영상볼때, 땡길때 계속 똑같은 광고가..;; 끝나면 다른광고나오고.. 지금 똑같은 광고를 4번을 봤어요..;;"
이종환, 2,2021-05-23,0,한국 광고가 좀 많이 나와 가지고 조금 불편하긴 해요 근데 그렇게 불편하지 않아요 그리고 업데이트를 해야 된다고 하는데 그게 왠지 모르게 가지고 그래서 업데이트 하는데 시간을 잡아먹어 쪼금만 더 노력해 주세요 조금 업데이트를 왜 해야 하는지 누가 좀 알려 주면 좋을 거 같아 근데 어차피 하는 법 알아 더 좋을 거 같아요 근데 어차피 알아 가지고 근데 좀 수정을 해 주세요 전 이런 것 조금 그래 가지고
오렌지, 4,2021-05-25,1,"보기 싫은 영상이나, 유해한 영상, 광고가 최근 늘어나고 있는 점과 내 시간을 뺏어버리는 점에서 4별"
공부하는라이언, 4,2021-06-09,0,엄청 좋은앱입니다 가끔 프로필 사진변경이 빨리 안됩니다 그리고 채널 정지가 잘 먹히는건지 모르겠네요 그래도 잘 사용하고 있습니다:)☺
도토리묵, 1,2021-05-31,1,안드로이드 One UI 3.1 업뎃 하기 전에는 오류없이 잘 됐는데 업뎃하고나서 팝업형태로 동영상 재생하면 100%렉 걸려요 빨리좀 고쳐주세요 글고요즘 렉 오지게걸려요 스크롤만 해도 렉 오짐
Seoul Kim, 1,2021-05-30,0,화질 설정에서 바꿔도 좀지나면 다시 자동으로 바뀌는데 어떻게 좀 고치세요 화질설정을 고정할수 없어서 너무 불편합니다
성이름, 4,2021-05-23,1,유튜브 프리미엄 쓰는데 서버 터질때마다 아무 보상 없는거 좀 에바라고 생각함 환불을 해주던가 사용시간 차감을 시켜주던가
김용, 1,2021-06-05,1,쓰면쓸수록 개같다는 생각밖에 안드는게 뭔 프리미엄결제해서 쓰고있는데 영상이랑 댓글을 같이보는데도 렉이 그렇게 걸려대는지 갤21울트라가 아직까지 하자있는 기종은 아닐텐데..
안단티나, 3,2021-05-26,0,광고 환경이 좋지 않습니다. 가끔씩 부적절한 광고가 나와요 (선정성이 대부분)
ᄌᄉ, 1,2021-06-01,0,요새 광고 진짜로 심해졌네 광고야 당연히 있어야 되는건데 선을 넘었다 진짜 5분에 한번씩 무한으로 광고가 떠서 볼수가없네
김순기, 1,2021-06-03,0,이거 화질문제도 있고 버그도 있음 하다가 갑자기 소리가 안나옴 ㅋㅋ 스트리밍하는데는 많은데 녹화해서 올리는데가 없으니까 막나가는식임
공륭이, 5,2021-05-31,1,영상올렸을때 화질넘 구려요.. 글고 영상조회수가 오류인건지는모르지만 너무 실시간으로 계속 쭉올라가서..
키범이는귀엽습니다아, 4,2021-06-01,1,다 좋고 자신이 보는 주제를 올려주어서 좋습니다. 하지만 광고가 너무 많이 나와서 별 4개 입니다!
블루베리, 1,2021-05-26,1,화질이 너무 쓰레기 처럼 나와요 영산 볼때마다 화질 수정해야하니 너무 귀찮아요 업데이트를 사람들 편하게 해주기 위한게 아니라 불편하게 만드려고 업데이트를 하는건가요?
그림그리는감수성, 4,2021-05-22,2,이건 제가 좋지않은 습관이기도 한데요 채널명을 바꾸는것을 제한 하는건 어때요?1개월.3개월등으로요 일주일에도 너무 자주 바꿔서요.초보 유튜브는 제한을 완하해주고 그런건 어떨까요?
박초희, 5,2021-06-06,0,완전 좋아요 TV에서 늦어서 못보는게 많은데 유튜브에서는 많이볼수 있어요제마으은5555000000000000000이에요 유튜브사랑해요~~~~
디펜뚜맞음, 1,2021-06-05,0,제가 유튭을 들어갔는데 갑자기 로그인을 해라뜨고 유튭이 안되더라구요.. 이것좀 고쳐주세요 게속 유튭 못보고 있습니다
신민경, 1,2021-06-02,0,pip모드 왜이러나요? 왜 안움찍이죠 화면으? 오른쪽 밑 가생이에서 움직이지가 않잖아 업데이트이후로 고쳐노으라고 빡치네
악령찬수, 2,2021-05-27,0,유튭관계자한테 죄송하지만 약간의 잘못이있어서 별점2개를줬습니다제가별점2개를준이유 (해외)포함저작권자의 허락을맡았는데도불굴하고 계정정지를하고있다는 제보가 특히 해외애니 그리고 19금설정을했는데도정지를 게다가 문의및 풀어달라고 요청을했는데도 안들어준다는 제보가있어서 특히 asmr영상 제가그분들의유튭관계자님이 제가 부탁을받을줄로만알고있지만 전혀부탁을안받았고 제개인적인생각및 asmr 및 해외애니구독자들을 다알고있어요 그조항을바꾸꺼나 아니면 확인이라도해주세요 아맞다 1가지를 빼먹을뻔했네요 저작권자도 아닌데 저작권자행세를 하고있다는 제보가있던대여 그것도 엄격하게 확인을 해주세요 음악유튜버&애니유튜버들을 저작권자들의 허락을받고 올리거든요 그것도 감안해주세요
